{"schemaVersion":"1.0","assessmentId":"00000000-0000-5000-8000-000000000005","foldId":"fold-1","sensorId":"s1","operatingCycleId":"00000000-0000-5000-8000-000000000003","trainingWindow":{"start":"2026-08-22T11:00:00.000Z","end":"2026-08-22T11:30:00.000Z"},"assessmentWindow":{"start":"2026-08-22T11:30:00.001Z","end":"2026-08-22T12:00:00.000Z"},"assessmentAt":"2026-08-22T12:00:00.000Z","anchorPointId":"00000000-0000-5000-8000-000000000004","status":"watch","anomalyScore":0.1,"deteriorationScore":0.2,"scoreSemantics":"relative_to_walk_forward_historical_baseline_not_failure_probability","persistence":{"episodeId":"episode-1","episodeStartedAt":"2026-08-22T11:45:00.000Z","persistenceSeconds":900,"persistenceCount":2},"quality":{"status":"ok","flags":[]},"evidence":[],"modelFamily":"robust-baseline","modelVersion":"1.0","modelHash":"sha256:dddddddddddddddddddddddddddddddddddddddddddddddddddddddddddddddd","foldHash":"sha256:eeeeeeeeeeeeeeeeeeeeeeeeeeeeeeeeeeeeeeeeeeeeeeeeeeeeeeeeeeeeeeee","reportHash":"sha256:ffffffffffffffffffffffffffffffffffffffffffffffffffffffffffffffff","componentTag":null,"humanValidationRequired":true,"limitations":[]}
